{
  "$schema": "https://json-schema.org/draft/2020-12/schema",
  "$id": "https://language-ai.local/schemas/dictionary-build-manifest-v1.json",
  "title": "Language AI Dictionary Build Manifest v1",
  "type": "object",
  "required": [
    "manifest_version",
    "example_only",
    "status",
    "build_id",
    "created_at",
    "repository",
    "sources",
    "import",
    "statistics",
    "validation",
    "outputs",
    "rollback"
  ],
  "properties": {
    "manifest_version": {"const": 1},
    "example_only": {"type": "boolean"},
    "status": {"enum": ["building", "candidate_validated", "failed"]},
    "build_id": {"type": "string", "minLength": 12, "maxLength": 120, "pattern": "^[A-Za-z0-9._-]+$"},
    "created_at": {"type": "string", "format": "date-time"},
    "repository": {
      "type": "object",
      "required": ["url", "importer_git_sha", "worktree_clean", "dictionary_schema_version", "forms_sidecar_schema_version", "python_version"],
      "properties": {
        "url": {"type": "string", "format": "uri", "pattern": "^https://"},
        "importer_git_sha": {"$ref": "#/$defs/sha1"},
        "worktree_clean": {"const": true},
        "dictionary_schema_version": {"type": "integer", "minimum": 1},
        "forms_sidecar_schema_version": {"type": "integer", "minimum": 1},
        "python_version": {"type": "string", "minLength": 1}
      },
      "additionalProperties": false
    },
    "sources": {
      "type": "array",
      "minItems": 2,
      "maxItems": 2,
      "allOf": [
        {"contains": {"type": "object", "properties": {"entry_language": {"const": "en"}}, "required": ["entry_language"]}, "minContains": 1, "maxContains": 1},
        {"contains": {"type": "object", "properties": {"entry_language": {"const": "de"}}, "required": ["entry_language"]}, "minContains": 1, "maxContains": 1}
      ],
      "items": {
        "type": "object",
        "required": ["edition", "entry_language", "acquisition_url", "resolved_url", "rolling_url", "snapshot_identity", "dates", "http_evidence", "license", "artifact_name"],
        "properties": {
          "edition": {"type": "string", "minLength": 1},
          "entry_language": {"enum": ["en", "de"]},
          "acquisition_url": {"type": "string", "format": "uri", "pattern": "^https://"},
          "resolved_url": {"type": "string", "format": "uri", "pattern": "^https://"},
          "rolling_url": {"type": "boolean"},
          "snapshot_identity": {
            "type": "object",
            "required": ["sha256", "size_bytes"],
            "properties": {
              "sha256": {"$ref": "#/$defs/sha256"},
              "size_bytes": {"type": "integer", "minimum": 0}
            },
            "additionalProperties": false
          },
          "dates": {
            "type": "object",
            "required": ["dump_date", "dump_date_status", "extraction_date", "extraction_date_status", "retrieved_at"],
            "properties": {
              "dump_date": {"type": ["string", "null"], "format": "date"},
              "dump_date_status": {"enum": ["verified", "unverified"]},
              "extraction_date": {"type": ["string", "null"], "format": "date"},
              "extraction_date_status": {"enum": ["verified", "unverified"]},
              "retrieved_at": {"type": "string", "format": "date-time"}
            },
            "additionalProperties": false
          },
          "http_evidence": {
            "type": "object",
            "required": ["etag", "last_modified", "content_length"],
            "properties": {
              "etag": {"type": ["string", "null"]},
              "last_modified": {"type": ["string", "null"]},
              "content_length": {"type": ["integer", "null"], "minimum": 0}
            },
            "additionalProperties": false
          },
          "license": {
            "type": "object",
            "required": ["label", "notice_url", "attribution", "verified", "verified_at"],
            "properties": {
              "label": {"type": "string", "minLength": 1},
              "notice_url": {"type": "string", "format": "uri", "pattern": "^https://"},
              "attribution": {"type": "string", "minLength": 1},
              "verified": {"type": "boolean"},
              "verified_at": {"type": ["string", "null"], "format": "date-time"}
            },
            "additionalProperties": false
          },
          "artifact_name": {"type": "string", "pattern": "^[A-Za-z0-9][A-Za-z0-9._-]{0,119}\\.jsonl\\.gz$"}
        },
        "additionalProperties": false
      }
    },
    "import": {
      "type": "object",
      "required": ["command", "arguments", "started_at", "completed_at", "elapsed_seconds", "peak_rss_bytes"],
      "properties": {
        "command": {"const": "backend/scripts/import_kaikki_dictionary.py"},
        "arguments": {
          "type": "object",
          "required": ["database", "content_license", "english_input", "english_source_url", "german_input", "german_source_url"],
          "properties": {
            "database": {"const": "dictionary.sqlite3"},
            "content_license": {"type": "string", "minLength": 1},
            "english_input": {"type": "string", "pattern": "^[A-Za-z0-9][A-Za-z0-9._-]{0,119}\\.jsonl\\.gz$"},
            "english_source_url": {"type": "string", "format": "uri", "pattern": "^https://"},
            "german_input": {"type": "string", "pattern": "^[A-Za-z0-9][A-Za-z0-9._-]{0,119}\\.jsonl\\.gz$"},
            "german_source_url": {"type": "string", "format": "uri", "pattern": "^https://"}
          },
          "additionalProperties": false
        },
        "started_at": {"type": "string", "format": "date-time"},
        "completed_at": {"type": "string", "format": "date-time"},
        "elapsed_seconds": {"type": "number", "minimum": 0},
        "peak_rss_bytes": {"type": ["integer", "null"], "minimum": 0}
      },
      "additionalProperties": false
    },
    "statistics": {
      "type": "object",
      "required": ["entries", "senses", "forms", "pronunciations", "chinese_coverage", "alignment_telemetry"],
      "properties": {
        "entries": {"$ref": "#/$defs/counts"},
        "senses": {"$ref": "#/$defs/counts"},
        "forms": {"$ref": "#/$defs/counts"},
        "pronunciations": {"$ref": "#/$defs/counts"},
        "chinese_coverage": {
          "type": "object",
          "required": ["entries_with_chinese", "entry_percent", "senses_with_chinese", "sense_percent"],
          "properties": {
            "entries_with_chinese": {"$ref": "#/$defs/counts"},
            "entry_percent": {"$ref": "#/$defs/rates"},
            "senses_with_chinese": {"$ref": "#/$defs/counts"},
            "sense_percent": {"$ref": "#/$defs/rates"}
          },
          "additionalProperties": false
        },
        "alignment_telemetry": {"$ref": "#/$defs/telemetry"}
      },
      "additionalProperties": false
    },
    "validation": {
      "type": "object",
      "required": ["integrity_check", "foreign_key_error_count", "required_query_plans", "gold_case_failures", "forms_sidecar_status", "quality_report", "snapshot_comparison"],
      "properties": {
        "integrity_check": {"const": "ok"},
        "foreign_key_error_count": {"const": 0},
        "required_query_plans": {"const": "passed"},
        "gold_case_failures": {"type": "integer", "minimum": 0},
        "forms_sidecar_status": {"const": "available"},
        "quality_report": {"$ref": "#/$defs/output"},
        "snapshot_comparison": {
          "type": "object",
          "required": ["same_source_hashes_as_baseline", "attribution"],
          "properties": {
            "same_source_hashes_as_baseline": {"type": "boolean"},
            "attribution": {"type": "string", "minLength": 1}
          },
          "additionalProperties": false
        }
      },
      "additionalProperties": false
    },
    "outputs": {
      "type": "object",
      "required": ["dictionary", "forms_sidecar"],
      "properties": {
        "dictionary": {"$ref": "#/$defs/output"},
        "forms_sidecar": {
          "allOf": [
            {"$ref": "#/$defs/output"},
            {"type": "object", "required": ["source_identity_verified"], "properties": {"source_identity_verified": {"type": "boolean"}}}
          ]
        }
      },
      "additionalProperties": false
    },
    "rollback": {
      "type": "object",
      "required": ["required", "previous_build_id", "validated"],
      "properties": {
        "required": {"const": true},
        "previous_build_id": {"type": "string", "pattern": "^[A-Za-z0-9][A-Za-z0-9._-]{0,119}$"},
        "validated": {"type": "boolean"}
      },
      "additionalProperties": false
    }
  },
  "$defs": {
    "sha1": {"type": "string", "pattern": "^[0-9a-f]{40}$"},
    "sha256": {"type": "string", "pattern": "^[0-9a-f]{64}$"},
    "output": {
      "type": "object",
      "required": ["path", "sha256", "size_bytes"],
      "properties": {
        "path": {"type": "string", "pattern": "^[A-Za-z0-9][A-Za-z0-9._-]{0,119}$"},
        "sha256": {"$ref": "#/$defs/sha256"},
        "size_bytes": {"type": "integer", "minimum": 0},
        "source_identity_verified": {"type": "boolean"}
      },
      "additionalProperties": false
    },
    "counts": {
      "type": "object",
      "required": ["en", "de", "total"],
      "properties": {
        "en": {"type": "integer", "minimum": 0},
        "de": {"type": "integer", "minimum": 0},
        "total": {"type": "integer", "minimum": 0}
      },
      "additionalProperties": false
    },
    "rates": {
      "type": "object",
      "required": ["en", "de", "total"],
      "properties": {
        "en": {"type": "number", "minimum": 0, "maximum": 100},
        "de": {"type": "number", "minimum": 0, "maximum": 100},
        "total": {"type": "number", "minimum": 0, "maximum": 100}
      },
      "additionalProperties": false
    },
    "telemetry": {
      "type": "object",
      "required": ["instrumentation_status", "sense_local", "entry_level"],
      "properties": {
        "instrumentation_status": {"enum": ["example", "complete"]},
        "sense_local": {
          "type": "object",
          "required": ["seen", "retained", "deduplicated", "truncated"],
          "properties": {
            "seen": {"type": "integer", "minimum": 0},
            "retained": {"type": "integer", "minimum": 0},
            "deduplicated": {"type": "integer", "minimum": 0},
            "truncated": {"type": "integer", "minimum": 0}
          },
          "additionalProperties": false
        },
        "entry_level": {
          "type": "object",
          "required": ["seen", "accepted", "rejected"],
          "properties": {
            "seen": {"type": "integer", "minimum": 0},
            "accepted": {
              "type": "object",
              "required": ["unique_multi_token", "reliable_single_token_head", "unscoped_single_sense", "equivalent_group", "single_sense_fallback", "total"],
              "properties": {
                "unique_multi_token": {"type": "integer", "minimum": 0},
                "reliable_single_token_head": {"type": "integer", "minimum": 0},
                "unscoped_single_sense": {"type": "integer", "minimum": 0},
                "equivalent_group": {"type": "integer", "minimum": 0},
                "single_sense_fallback": {"type": "integer", "minimum": 0},
                "total": {"type": "integer", "minimum": 0}
              },
              "additionalProperties": false
            },
            "rejected": {
              "type": "object",
              "required": ["ambiguous_or_tied", "zero_evidence", "generic_stopword_or_lemma_only", "single_sense_mismatch", "unsupported_morphology", "weak_single_token_evidence", "over_limit", "total"],
              "properties": {
                "ambiguous_or_tied": {"type": "integer", "minimum": 0},
                "zero_evidence": {"type": "integer", "minimum": 0},
                "generic_stopword_or_lemma_only": {"type": "integer", "minimum": 0},
                "single_sense_mismatch": {"type": "integer", "minimum": 0},
                "unsupported_morphology": {"type": "integer", "minimum": 0},
                "weak_single_token_evidence": {"type": "integer", "minimum": 0},
                "over_limit": {"type": "integer", "minimum": 0},
                "total": {"type": "integer", "minimum": 0}
              },
              "additionalProperties": false
            }
          },
          "additionalProperties": false
        }
      },
      "additionalProperties": false
    }
  }
}
